[
  {"id": "ember-touch", "rulesVersion": "1.0.0", "displayName": "Ember Touch", "school": "pyromancy", "tradition": "arcane", "tier": 1, "mpCost": 1, "castingTime": "action", "range": "touch", "attack": {"damage": "1d8", "damageType": "fire"}},
  {"id": "ash-veil", "rulesVersion": "1.0.0", "displayName": "Ash Veil", "school": "pyromancy", "tradition": "arcane", "tier": 2, "mpCost": 2, "castingTime": "action", "range": "30 ft", "save": {"dc": 12, "ability": "STA"}, "effect": "10 ft radius; Poisoned 1 round on fail"},
  {"id": "firebolt", "rulesVersion": "1.0.0", "displayName": "Firebolt", "school": "pyromancy", "tradition": "arcane", "tier": 2, "mpCost": 2, "castingTime": "action", "range": "60 ft", "attack": {"damage": "1d10", "damageType": "fire"}},
  {"id": "aegis-spark", "rulesVersion": "1.0.0", "displayName": "Aegis Spark", "school": "ward", "tradition": "arcane", "tier": 1, "mpCost": 1, "castingTime": "action", "range": "self", "effect": "+2 AC vs spells until next turn"},
  {"id": "seal-threshold", "rulesVersion": "1.0.0", "displayName": "Seal Threshold", "school": "ward", "tradition": "arcane", "tier": 2, "mpCost": 2, "castingTime": "action", "range": "touch", "effect": "Magical lock DC 14"},
  {"id": "ward-circle", "rulesVersion": "1.0.0", "displayName": "Ward Circle", "school": "ward", "tradition": "arcane", "tier": 3, "mpCost": 3, "castingTime": "action", "range": "10 ft", "effect": "Undead disadvantage entering 10 ft until end of next turn"},
  {"id": "thorn-prick", "rulesVersion": "1.0.0", "displayName": "Thorn Prick", "school": "biomancy", "tradition": "arcane", "tier": 1, "mpCost": 1, "castingTime": "action", "range": "30 ft", "attack": {"damage": "1d6", "damageType": "piercing"}},
  {"id": "sap-mend", "rulesVersion": "1.0.0", "displayName": "Sap Mend", "school": "biomancy", "tradition": "arcane", "tier": 1, "mpCost": 1, "castingTime": "action", "range": "touch", "effect": "Heal 1d4 + INT mod"},
  {"id": "entangle", "rulesVersion": "1.0.0", "displayName": "Entangle", "school": "biomancy", "tradition": "arcane", "tier": 2, "mpCost": 2, "castingTime": "action", "range": "60 ft", "save": {"dc": 12, "ability": "STR"}, "effect": "Restrained until end of next turn"},
  {"id": "grave-chill", "rulesVersion": "1.0.0", "displayName": "Grave Chill", "school": "necromancy", "tradition": "arcane", "tier": 1, "mpCost": 1, "castingTime": "action", "range": "30 ft", "attack": {"damage": "1d8", "damageType": "necrotic"}},
  {"id": "corpse-speak", "rulesVersion": "1.0.0", "displayName": "Corpse Speak", "school": "necromancy", "tradition": "arcane", "tier": 1, "mpCost": 1, "castingTime": "action", "range": "touch", "effect": "One question to corpse; DC 12 SPI"},
  {"id": "fear-gasp", "rulesVersion": "1.0.0", "displayName": "Fear Gasp", "school": "necromancy", "tradition": "arcane", "tier": 2, "mpCost": 2, "castingTime": "action", "range": "15 ft cone", "save": {"dc": 12, "ability": "SPI"}, "effect": "Frightened until end of next turn"},
  {"id": "static-lash", "rulesVersion": "1.0.0", "displayName": "Static Lash", "school": "ether", "tradition": "arcane", "tier": 1, "mpCost": 1, "castingTime": "action", "range": "30 ft", "attack": {"damage": "1d6", "damageType": "force"}},
  {"id": "veil-peek", "rulesVersion": "1.0.0", "displayName": "Veil Peek", "school": "ether", "tradition": "arcane", "tier": 1, "mpCost": 1, "castingTime": "action", "range": "self", "effect": "See EP creatures 30 ft for 1 minute"},
  {"id": "disrupt-weave", "rulesVersion": "1.0.0", "displayName": "Disrupt Weave", "school": "ether", "tradition": "arcane", "tier": 2, "mpCost": 2, "castingTime": "reaction", "range": "30 ft", "save": {"dc": 12, "ability": "INT"}, "effect": "Counter spell on failed save"},
  {"id": "mend-light", "rulesVersion": "1.0.0", "displayName": "Mend Light", "school": "divine", "tradition": "divine", "tier": 1, "mpCost": 1, "castingTime": "action", "range": "touch", "effect": "Heal 1d6 + SPI mod"},
  {"id": "consecrate-ground", "rulesVersion": "1.0.0", "displayName": "Consecrate Ground", "school": "divine", "tradition": "divine", "tier": 1, "mpCost": 1, "castingTime": "action", "range": "5 ft", "effect": "Holy 5 ft until rest"},
  {"id": "turn-ash", "rulesVersion": "1.0.0", "displayName": "Turn Ash", "school": "divine", "tradition": "divine", "tier": 2, "mpCost": 2, "castingTime": "action", "range": "30 ft", "save": {"dc": 12, "ability": "SPI"}, "effect": "Undead Frightened 1 round"},
  {"id": "inferno-wave", "rulesVersion": "1.0.0", "displayName": "Inferno Wave", "school": "pyromancy", "tradition": "arcane", "tier": 4, "mpCost": 4, "castingTime": "action", "range": "30 ft cone", "save": {"dc": 14, "ability": "STA"}, "effect": "3d6 fire; half on success"},
  {"id": "phoenix-mantle", "rulesVersion": "1.0.0", "displayName": "Phoenix Mantle", "school": "pyromancy", "tradition": "arcane", "tier": 5, "mpCost": 5, "castingTime": "action", "range": "self", "concentration": true, "duration": "1 minute", "effect": "+2 fire on spell attacks; resist cold"},
  {"id": "banish-unlife", "rulesVersion": "1.0.0", "displayName": "Banish Unlife", "school": "ward", "tradition": "arcane", "tier": 4, "mpCost": 4, "castingTime": "action", "range": "30 ft", "save": {"dc": 14, "ability": "SPI"}, "effect": "Undead Frightened 1 minute on fail"},
  {"id": "fortress-sigil", "rulesVersion": "1.0.0", "displayName": "Fortress Sigil", "school": "ward", "tradition": "arcane", "tier": 5, "mpCost": 5, "castingTime": "action", "range": "touch", "concentration": true, "duration": "10 minutes", "effect": "Target +4 AC"},
  {"id": "overgrowth", "rulesVersion": "1.0.0", "displayName": "Overgrowth", "school": "biomancy", "tradition": "arcane", "tier": 4, "mpCost": 4, "castingTime": "action", "range": "60 ft", "save": {"dc": 14, "ability": "STR"}, "effect": "15 ft radius difficult terrain; 2d6 piercing half on save"},
  {"id": "heartwood-bark", "rulesVersion": "1.0.0", "displayName": "Heartwood Bark", "school": "biomancy", "tradition": "arcane", "tier": 5, "mpCost": 5, "castingTime": "action", "range": "self", "duration": "10 minutes", "effect": "+3 AC (natural); resist piercing"},
  {"id": "wither", "rulesVersion": "1.0.0", "displayName": "Wither", "school": "necromancy", "tradition": "arcane", "tier": 4, "mpCost": 4, "castingTime": "action", "range": "60 ft", "attack": {"damage": "3d8", "damageType": "necrotic"}},
  {"id": "army-of-ash", "rulesVersion": "1.0.0", "displayName": "Army of Ash", "school": "necromancy", "tradition": "arcane", "tier": 5, "mpCost": 5, "castingTime": "action", "range": "30 ft", "duration": "1 minute", "effect": "Summon 2 hazard ash shades (d20+4 claw 1d6+2)"},
  {"id": "veil-tear", "rulesVersion": "1.0.0", "displayName": "Veil Tear", "school": "ether", "tradition": "arcane", "tier": 4, "mpCost": 4, "castingTime": "action", "range": "30 ft", "attack": {"damage": "2d10", "damageType": "force"}, "effect": "Thin-veil: +1 threat clock segment"},
  {"id": "wild-surge", "rulesVersion": "1.0.0", "displayName": "Wild Surge", "school": "ether", "tradition": "arcane", "tier": 5, "mpCost": 5, "castingTime": "bonus action", "range": "self", "effect": "Roll wild magic table; Sorcerer deed hook"},
  {"id": "sun-smite", "rulesVersion": "1.0.0", "displayName": "Sun Smite", "school": "divine", "tradition": "divine", "tier": 4, "mpCost": 4, "castingTime": "action", "range": "touch", "attack": {"damage": "2d8", "damageType": "radiant"}, "effect": "+2d8 radiant vs undead"},
  {"id": "sanctuary-hymn", "rulesVersion": "1.0.0", "displayName": "Sanctuary Hymn", "school": "divine", "tradition": "divine", "tier": 5, "mpCost": 5, "castingTime": "action", "range": "30 ft", "duration": "1 minute", "effect": "One ally +4 on saves vs magical effects"}
]
